"No.","Time","Source","Destination","Protocol","Length","Text item","Source Port","Destination Port","Host","Info"
"1","0.000000","192.168.3.22","172.217.12.36","QUIC","388","","53507","443","","Payload (Encrypted), PKN: 10, CID: 889214629929434550"
"2","0.003344","192.168.3.22","216.58.194.74","QUIC","304","","54328","443","","Payload (Encrypted), PKN: 9, CID: 10222061285682625119"
"3","0.131933","192.168.3.22","172.217.12.36","QUIC","388","","53507","443","","Payload (Encrypted), PKN: 11, CID: 889214629929434550"
"4","0.148765","192.168.3.22","216.58.194.74","QUIC","304","","54328","443","","Payload (Encrypted), PKN: 10, CID: 10222061285682625119"
"5","0.160672","172.217.12.36","192.168.3.22","QUIC","65","","443","53507","","Payload (Encrypted), PKN: 11"
"6","0.168377","216.58.194.74","192.168.3.22","QUIC","65","","443","54328","","Payload (Encrypted), PKN: 10"
"7","0.186071","172.217.12.36","192.168.3.22","QUIC","381","","443","53507","","Payload (Encrypted), PKN: 12"
"8","0.187802","172.217.12.36","192.168.3.22","QUIC","61","","443","53507","","Payload (Encrypted), PKN: 13"
"9","0.187974","192.168.3.22","172.217.12.36","QUIC","70","","53507","443","","Payload (Encrypted), PKN: 12, CID: 889214629929434550"
"10","0.188150","172.217.12.36","192.168.3.22","QUIC","161","","443","53507","","Payload (Encrypted), PKN: 14"
"11","0.213751","192.168.3.22","172.217.12.36","QUIC","70","","53507","443","","Payload (Encrypted), PKN: 13, CID: 889214629929434550"
"12","0.242366","216.58.194.74","192.168.3.22","QUIC","235","","443","54328","","Payload (Encrypted), PKN: 11"
"13","0.245574","216.58.194.74","192.168.3.22","QUIC","270","","443","54328","","Payload (Encrypted), PKN: 12"
"14","0.245785","192.168.3.22","216.58.194.74","QUIC","70","","54328","443","","Payload (Encrypted), PKN: 11, CID: 10222061285682625119"
"15","3.724100","192.168.3.22","185.199.108.153","TCP","78","","50728","","","50728  >  80 [SYN] Seq=0 Win=65535 Len=0 MSS=1460 WS=32 TSval=776859865 TSecr=0 SACK_PERM=1"
"16","3.744238","185.199.108.153","192.168.3.22","TCP","74","","80","","","80  >  50728 [SYN, ACK] Seq=0 Ack=1 Win=28960 Len=0 MSS=1460 SACK_PERM=1 TSval=1450204718 TSecr=776859865 WS=512"
"17","3.744456","192.168.3.22","185.199.108.153","TCP","66","","50728","","","50728  >  80 [ACK] Seq=1 Ack=1 Win=131744 Len=0 TSval=776859885 TSecr=1450204718"
"18","3.744728","192.168.3.22","185.199.108.153","HTTP","745","","50728","","www.austintaylor.io","GET /d3/python/pandas/2016/02/01/create-d3-chart-python-force-directed/ HTTP/1.1 "
"19","3.764525","185.199.108.153","192.168.3.22","TCP","66","","80","","","80  >  50728 [ACK] Seq=1 Ack=680 Win=30720 Len=0 TSval=1450204723 TSecr=776859885"
"20","3.807683","185.199.108.153","192.168.3.22","HTTP","465","","80","","","HTTP/1.1 304 Not Modified "
"21","3.807765","192.168.3.22","185.199.108.153","TCP","66","","50728","","","50728  >  80 [ACK] Seq=680 Ack=400 Win=131360 Len=0 TSval=776859947 TSecr=1450204733"
"22","3.853294","192.168.3.22","185.199.108.153","HTTP","652","","50728","","www.austintaylor.io","GET /css/pixyll.css?201812162216 HTTP/1.1 "
"23","3.855827","192.168.3.22","185.199.108.153","TCP","78","","50729","","","50729  >  80 [SYN] Seq=0 Win=65535 Len=0 MSS=1460 WS=32 TSval=776859994 TSecr=0 SACK_PERM=1"
"24","3.856048","192.168.3.22","185.199.108.153","TCP","78","","50730","","","50730  >  80 [SYN] Seq=0 Win=65535 Len=0 MSS=1460 WS=32 TSval=776859994 TSecr=0 SACK_PERM=1"
"25","3.871894","185.199.108.153","192.168.3.22","TCP","66","","80","","","80  >  50728 [ACK] Seq=400 Ack=1266 Win=31744 Len=0 TSval=1450204750 TSecr=776859992"
"26","3.878571","185.199.108.153","192.168.3.22","TCP","74","","80","","","80  >  50729 [SYN, ACK] Seq=0 Ack=1 Win=28960 Len=0 MSS=1460 SACK_PERM=1 TSval=1449785130 TSecr=776859994 WS=512"
"27","3.878662","192.168.3.22","185.199.108.153","TCP","66","","50729","","","50729  >  80 [ACK] Seq=1 Ack=1 Win=131744 Len=0 TSval=776860016 TSecr=1449785130"
"28","3.878808","192.168.3.22","185.199.108.153","HTTP","666","","50729","","www.austintaylor.io","GET /images/set_filter.png HTTP/1.1 "
"29","3.881516","185.199.108.153","192.168.3.22","TCP","74","","80","","","80  >  50730 [SYN, ACK] Seq=0 Ack=1 Win=28960 Len=0 MSS=1460 SACK_PERM=1 TSval=1450205572 TSecr=776859994 WS=512"
"30","3.881564","192.168.3.22","185.199.108.153","TCP","66","","50730","","","50730  >  80 [ACK] Seq=1 Ack=1 Win=131744 Len=0 TSval=776860018 TSecr=1450205572"
"31","3.881682","192.168.3.22","185.199.108.153","HTTP","666","","50730","","www.austintaylor.io","GET /images/pre_marked.png HTTP/1.1 "
"32","3.891408","185.199.108.153","192.168.3.22","TCP","66","","80","","","80  >  50729 [ACK] Seq=1 Ack=601 Win=30208 Len=0 TSval=1449785133 TSecr=776860016"
"33","3.895778","185.199.108.153","192.168.3.22","TCP","66","","80","","","80  >  50730 [ACK] Seq=1 Ack=601 Win=30208 Len=0 TSval=1450205577 TSecr=776860018"
"34","3.912646","185.199.108.153","192.168.3.22","HTTP","464","","80","","","HTTP/1.1 304 Not Modified "
"35","3.912689","192.168.3.22","185.199.108.153","TCP","66","","50728","","","50728  >  80 [ACK] Seq=1266 Ack=798 Win=130944 Len=0 TSval=776860047 TSecr=1450204760"
"36","3.932565","192.168.3.22","208.180.42.100","DNS","80","","43642","53","","Standard query 0x6b48 A cdnjs.cloudflare.com"
"37","3.932775","192.168.3.22","208.180.42.100","DNS","83","","62825","53","","Standard query 0x641b A maxcdn.bootstrapcdn.com"
"38","3.932881","185.199.108.153","192.168.3.22","HTTP","463","","80","","","HTTP/1.1 304 Not Modified "
"39","3.932926","192.168.3.22","185.199.108.153","TCP","66","","50729","","","50729  >  80 [ACK] Seq=601 Ack=398 Win=131360 Len=0 TSval=776860067 TSecr=1449785143"
"40","3.934491","192.168.3.22","208.180.42.100","DNS","77","","57828","53","","Standard query 0xb1aa A fonts.gstatic.com"
"41","3.942845","185.199.108.153","192.168.3.22","HTTP","463","","80","","","HTTP/1.1 304 Not Modified "
"42","3.942903","192.168.3.22","185.199.108.153","TCP","66","","50730","","","50730  >  80 [ACK] Seq=601 Ack=398 Win=131360 Len=0 TSval=776860076 TSecr=1450205588"
"43","3.948913","192.168.3.22","185.199.108.153","HTTP","669","","50730","","www.austintaylor.io","GET /images/marked_export.png HTTP/1.1 "
"44","3.951523","192.168.3.22","185.199.108.153","HTTP","763","","50729","","www.austintaylor.io","GET /static/examples/force_directed/index.html HTTP/1.1 "
"45","3.961784","208.180.42.100","192.168.3.22","DNS","160","","53","43642","","Standard query response 0x6b48 A cdnjs.cloudflare.com A 104.19.198.151 A 104.19.199.151 A 104.19.196.151 A 104.19.195.151 A 104.19.197.151"
"46","3.965478","185.199.108.153","192.168.3.22","TCP","66","","80","","","80  >  50729 [ACK] Seq=398 Ack=1298 Win=31744 Len=0 TSval=1449785151 TSecr=776860084"
"47","3.965954","185.199.108.153","192.168.3.22","TCP","66","","80","","","80  >  50730 [ACK] Seq=398 Ack=1204 Win=31744 Len=0 TSval=1450205594 TSecr=776860082"
"48","3.967301","208.180.42.100","192.168.3.22","DNS","135","","53","62825","","Standard query response 0x641b A maxcdn.bootstrapcdn.com CNAME cds.j3z9t3p6.hwcdn.net A 209.197.3.15"
"49","3.968376","208.180.42.100","192.168.3.22","DNS","129","","53","57828","","Standard query response 0xb1aa A fonts.gstatic.com CNAME gstaticadssl.l.google.com A 216.58.193.131"
"50","3.973750","192.168.3.22","216.58.193.131","QUIC","1392","","55716","443","","Client Hello, PKN: 1, CID: 11656230795162929627"
"51","3.996666","216.58.193.131","192.168.3.22","QUIC","1392","","443","55716","","Payload (Encrypted), PKN: 1"
"52","3.997092","216.58.193.131","192.168.3.22","QUIC","73","","443","55716","","Payload (Encrypted), PKN: 2"
"53","3.997107","192.168.3.22","216.58.193.131","QUIC","81","","55716","443","","Payload (Encrypted), PKN: 2, CID: 11656230795162929627"
"54","3.997144","192.168.3.22","216.58.193.131","QUIC","70","","55716","443","","Payload (Encrypted), PKN: 3, CID: 11656230795162929627"
"55","4.011140","185.199.108.153","192.168.3.22","HTTP","464","","80","","","HTTP/1.1 304 Not Modified "
"56","4.011190","192.168.3.22","185.199.108.153","TCP","66","","50729","","","50729  >  80 [ACK] Seq=1298 Ack=796 Win=130944 Len=0 TSval=776860143 TSecr=1449785162"
"57","4.012573","185.199.108.153","192.168.3.22","HTTP","463","","80","","","HTTP/1.1 304 Not Modified "
"58","4.012611","192.168.3.22","185.199.108.153","TCP","66","","50730","","","50730  >  80 [ACK] Seq=1204 Ack=795 Win=130944 Len=0 TSval=776860144 TSecr=1450205606"
"59","4.022319","192.168.3.22","216.58.193.131","QUIC","70","","55716","443","","Payload (Encrypted), PKN: 4, CID: 11656230795162929627"
"60","4.035058","216.58.193.131","192.168.3.22","QUIC","62","","443","55716","","Payload (Encrypted), PKN: 3"
"61","4.060000","192.168.3.22","208.180.42.100","DNS","71","","61075","53","","Standard query 0xc377 A bl.ocks.org"
"62","4.060186","192.168.3.22","208.180.42.100","DNS","70","","34358","53","","Standard query 0x3647 A github.com"
"63","4.060626","192.168.3.22","208.180.42.100","DNS","70","","27239","53","","Standard query 0x8e56 A medium.com"
"64","4.062039","192.168.3.22","208.180.42.100","DNS","76","","11326","53","","Standard query 0x0618 A www.gravatar.com"
"65","4.062198","192.168.3.22","185.199.108.153","HTTP","677","","50730","","www.austintaylor.io","GET /images/start_webserver_python.png HTTP/1.1 "
"66","4.062314","192.168.3.22","185.199.108.153","HTTP","668","","50729","","www.austintaylor.io","GET /images/zoomed_out1.png HTTP/1.1 "
"67","4.077382","185.199.108.153","192.168.3.22","TCP","66","","80","","","80  >  50730 [ACK] Seq=795 Ack=1815 Win=32768 Len=0 TSval=1450205622 TSecr=776860193"
"68","4.078864","208.180.42.100","192.168.3.22","DNS","102","","53","34358","","Standard query response 0x3647 A github.com A 192.30.253.112 A 192.30.253.113"
"69","4.078866","208.180.42.100","192.168.3.22","DNS","92","","53","11326","","Standard query response 0x0618 A www.gravatar.com A 192.0.73.2"
"70","4.078867","208.180.42.100","192.168.3.22","DNS","150","","53","27239","","Standard query response 0x8e56 A medium.com A 104.16.122.127 A 104.16.123.127 A 104.16.120.127 A 104.16.121.127 A 104.16.124.127"
"71","4.078868","208.180.42.100","192.168.3.22","DNS","103","","53","61075","","Standard query response 0xc377 A bl.ocks.org A 104.18.33.186 A 104.18.32.186"
"72","4.079293","192.168.3.22","192.0.73.2","TCP","78","","50731","","","50731  >  80 [SYN] Seq=0 Win=65535 Len=0 MSS=1460 WS=32 TSval=776860209 TSecr=0 SACK_PERM=1"
"73","4.080208","192.168.3.22","208.180.42.100","DNS","77","","46741","53","","Standard query 0x5c7d A pandas.pydata.org"
"74","4.080494","192.168.3.22","208.180.42.100","DNS","80","","61058","53","","Standard query 0xad6b A pen-testing.sans.org"
"75","4.080667","192.168.3.22","208.180.42.100","DNS","70","","45574","53","","Standard query 0xee9a A reddit.com"
"76","4.082768","185.199.108.153","192.168.3.22","TCP","66","","80","","","80  >  50729 [ACK] Seq=796 Ack=1900 Win=33280 Len=0 TSval=1449785181 TSecr=776860193"
"77","4.103861","192.0.73.2","192.168.3.22","TCP","66","","80","","","80  >  50731 [SYN, ACK] Seq=0 Ack=1 Win=29200 Len=0 MSS=1460 SACK_PERM=1 WS=512"
"78","4.103915","192.168.3.22","192.0.73.2","TCP","54","","50731","","","50731  >  80 [ACK] Seq=1 Ack=1 Win=262144 Len=0"
"79","4.104044","192.168.3.22","192.0.73.2","HTTP","568","","50731","","www.gravatar.com","GET /avatar/43b2350414d27e863919fec8f14e901c?s=120 HTTP/1.1 "
"80","4.112519","208.180.42.100","192.168.3.22","DNS","109","","53","46741","","Standard query response 0x5c7d A pandas.pydata.org A 104.25.157.35 A 104.25.156.35"
"81","4.113078","208.180.42.100","192.168.3.22","DNS","134","","53","45574","","Standard query response 0xee9a A reddit.com A 151.101.193.140 A 151.101.129.140 A 151.101.1.140 A 151.101.65.140"
"82","4.113834","192.168.3.22","208.180.42.100","DNS","71","","15480","53","","Standard query 0xf29e A twitter.com"
"83","4.114776","192.168.3.22","208.180.42.100","DNS","76","","34052","53","","Standard query 0x59b4 A www.linkedin.com"
"84","4.117024","185.199.108.153","192.168.3.22","HTTP","462","","80","","","HTTP/1.1 304 Not Modified "
"85","4.117096","192.168.3.22","185.199.108.153","TCP","66","","50730","","","50730  >  80 [ACK] Seq=1815 Ack=1191 Win=130656 Len=0 TSval=776860246 TSecr=1450205631"
"86","4.119787","185.199.108.153","192.168.3.22","HTTP","464","","80","","","HTTP/1.1 304 Not Modified "
"87","4.119855","192.168.3.22","185.199.108.153","TCP","66","","50729","","","50729  >  80 [ACK] Seq=1900 Ack=1194 Win=130656 Len=0 TSval=776860248 TSecr=1449785190"
"88","4.126537","192.0.73.2","192.168.3.22","TCP","60","","80","","","80  >  50731 [ACK] Seq=1 Ack=515 Win=30720 Len=0"
"89","4.127163","192.0.73.2","192.168.3.22","HTTP","543","","80","","","HTTP/1.1 304 Not Modified "
"90","4.127202","192.168.3.22","192.0.73.2","TCP","54","","50731","","","50731  >  80 [ACK] Seq=515 Ack=490 Win=261632 Len=0"
"91","4.131461","208.180.42.100","192.168.3.22","DNS","103","","53","15480","","Standard query response 0xf29e A twitter.com A 104.244.42.65 A 104.244.42.129"
"92","4.132459","208.180.42.100","192.168.3.22","DNS","115","","53","34052","","Standard query response 0x59b4 A www.linkedin.com CNAME pop-eda6.www.linkedin.com A 108.174.11.65"
"93","4.157410","208.180.42.100","192.168.3.22","DNS","132","","53","61058","","Standard query response 0xad6b A pen-testing.sans.org CNAME gouoho2.x.incapdns.net A 45.60.31.34"
"94","4.186253","192.168.3.22","208.180.42.100","DNS","72","","30193","53","","Standard query 0x175b A facebook.com"
"95","4.186618","192.168.3.22","208.180.42.100","DNS","80","","15681","53","","Standard query 0x8eeb A news.ycombinator.com"
"96","4.188283","192.168.3.22","208.180.42.100","DNS","84","","22880","53","","Standard query 0xec51 A austin-taylor.disqus.com"
"97","4.188827","192.168.3.22","208.180.42.100","DNS","75","","64243","53","","Standard query 0x34f8 A plus.google.com"
"98","4.203237","208.180.42.100","192.168.3.22","DNS","88","","53","30193","","Standard query response 0x175b A facebook.com A 31.13.93.35"
"99","4.203843","192.168.3.22","208.180.42.100","DNS","84","","6265","53","","Standard query 0x8bc9 A www.google-analytics.com"
"100","4.205970","192.168.3.22","208.180.42.100","DNS","79","","22935","53","","Standard query 0x12a3 A www.stumbleupon.com"
"101","4.209334","208.180.42.100","192.168.3.22","DNS","91","","53","64243","","Standard query response 0x34f8 A plus.google.com A 172.217.2.238"
"102","4.215928","192.168.3.22","185.199.108.153","HTTP","647","","50729","","www.austintaylor.io","GET /static/examples/force_directed/style.css HTTP/1.1 "
"103","4.219935","208.180.42.100","192.168.3.22","DNS","144","","53","6265","","Standard query response 0x8bc9 A www.google-analytics.com CNAME www-google-analytics.l.google.com A 172.217.6.174"
"104","4.224231","192.168.3.22","172.217.6.174","QUIC","1392","","52123","443","","Client Hello, PKN: 1, CID: 6563247271500482062"
"105","4.224618","192.168.3.22","172.217.6.174","QUIC","710","","52123","443","","Payload (Encrypted), PKN: 2, CID: 6563247271500482062"
"106","4.226270","208.180.42.100","192.168.3.22","DNS","143","","53","22935","","Standard query response 0x12a3 A www.stumbleupon.com A 13.33.112.175 A 13.33.112.109 A 13.33.112.20 A 13.33.112.127"
"107","4.226776","208.180.42.100","192.168.3.22","DNS","96","","53","15681","","Standard query response 0x8eeb A news.ycombinator.com A 209.216.230.240"
"108","4.232761","208.180.42.100","192.168.3.22","DNS","142","","53","22880","","Standard query response 0xec51 A austin-taylor.disqus.com CNAME prod.disqus.map.fastlylb.net A 151.101.48.134"
"109","4.232999","192.168.3.22","151.101.48.134","TCP","78","","50732","","","50732  >  443 [SYN] Seq=0 Win=65535 Len=0 MSS=1460 WS=32 TSval=776860359 TSecr=0 SACK_PERM=1"
"110","4.253926","151.101.48.134","192.168.3.22","TCP","74","","443","","","443  >  50732 [SYN, ACK] Seq=0 Ack=1 Win=28960 Len=0 MSS=1460 SACK_PERM=1 TSval=2522999126 TSecr=776860359 WS=512"
"111","4.254004","192.168.3.22","151.101.48.134","TCP","66","","50732","","","50732  >  443 [ACK] Seq=1 Ack=1 Win=131744 Len=0 TSval=776860379 TSecr=2522999126"
"112","4.254196","192.168.3.22","151.101.48.134","TLSv1.2","584","","50732","","","Client Hello"
"113","4.256447","172.217.6.174","192.168.3.22","QUIC","1392","","443","52123","","Payload (Encrypted), PKN: 1"
"114","4.256776","192.168.3.22","172.217.6.174","QUIC","83","","52123","443","","Payload (Encrypted), PKN: 3, CID: 6563247271500482062"
"115","4.256922","172.217.6.174","192.168.3.22","QUIC","73","","443","52123","","Payload (Encrypted), PKN: 2"
"116","4.256934","192.168.3.22","172.217.6.174","QUIC","70","","52123","443","","Payload (Encrypted), PKN: 4, CID: 6563247271500482062"
"117","4.271572","172.217.6.174","192.168.3.22","QUIC","314","","443","52123","","Payload (Encrypted), PKN: 3"
"118","4.271766","192.168.3.22","172.217.6.174","QUIC","70","","52123","443","","Payload (Encrypted), PKN: 5, CID: 6563247271500482062"
"119","4.275725","151.101.48.134","192.168.3.22","TCP","66","","443","","","443  >  50732 [ACK] Seq=1 Ack=519 Win=30208 Len=0 TSval=2522999130 TSecr=776860379"
"120","4.276157","151.101.48.134","192.168.3.22","TLSv1.2","226","","443","","","Server Hello, Change Cipher Spec, Encrypted Handshake Message"
"121","4.276160","172.217.6.174","192.168.3.22","QUIC","60","","443","52123","","Payload (Encrypted), PKN: 4"
"122","4.276230","192.168.3.22","151.101.48.134","TCP","66","","50732","","","50732  >  443 [ACK] Seq=519 Ack=161 Win=131584 Len=0 TSval=776860400 TSecr=2522999131"
"123","4.276527","192.168.3.22","151.101.48.134","TLSv1.2","117","","50732","","","Change Cipher Spec, Hello Request, Hello Request"
"124","4.283732","192.168.3.22","151.101.48.134","TLSv1.2","559","","50732","","","Application Data"
"125","4.294685","192.168.3.22","185.199.108.153","TCP","647","","50729","","","[TCP Retransmission] 50729  >  80 [PSH, ACK] Seq=1900 Ack=1194 Win=131072 Len=581 TSval=776860417 TSecr=1449785190"
"126","4.296953","172.217.6.174","192.168.3.22","QUIC","62","","443","52123","","Payload (Encrypted), PKN: 5"
"127","4.298624","151.101.48.134","192.168.3.22","TCP","66","","443","","","443  >  50732 [ACK] Seq=161 Ack=1063 Win=31232 Len=0 TSval=2522999137 TSecr=776860400"
"128","4.301780","192.168.3.22","172.217.6.174","QUIC","70","","52123","443","","Payload (Encrypted), PKN: 6, CID: 6563247271500482062"
"129","4.352354","185.199.108.153","192.168.3.22","HTTP","463","","80","","","HTTP/1.1 304 Not Modified "
"130","4.352456","192.168.3.22","185.199.108.153","TCP","66","","50729","","","50729  >  80 [ACK] Seq=2481 Ack=1591 Win=130656 Len=0 TSval=776860473 TSecr=1449785248"
"131","4.361876","192.168.3.22","185.199.108.153","HTTP","657","","50729","","www.austintaylor.io","GET /static/examples/force_directed/pcap_export.json HTTP/1.1 "
"132","4.424128","185.199.108.153","192.168.3.22","HTTP","464","","80","","","HTTP/1.1 304 Not Modified "
"133","4.424219","192.168.3.22","185.199.108.153","TCP","66","","50729","","","50729  >  80 [ACK] Seq=3072 Ack=1989 Win=130656 Len=0 TSval=776860544 TSecr=1449785266"
"134","4.444432","151.101.48.134","192.168.3.22","TCP","1514","","443","","","[TCP segment of a reassembled PDU]"
"135","4.444623","151.101.48.134","192.168.3.22","TLSv1.2","1406","","443","","","Application Data"
"136","4.444667","192.168.3.22","151.101.48.134","TCP","66","","50732","","","50732  >  443 [ACK] Seq=1063 Ack=2949 Win=129728 Len=0 TSval=776860564 TSecr=2522999174"
"137","4.444822","151.101.48.134","192.168.3.22","TCP","1514","","443","","","[TCP segment of a reassembled PDU]"
"138","4.446392","192.168.3.22","208.180.42.100","DNS","70","","5483","53","","Standard query 0x6dfc A disqus.com"
"139","4.446511","192.168.3.22","208.180.42.100","DNS","75","","48328","53","","Standard query 0x59b7 A c.disquscdn.com"
"140","4.447199","151.101.48.134","192.168.3.22","TLSv1.2","1406","","443","","","Application Data"
"141","4.447202","151.101.48.134","192.168.3.22","TCP","1514","","443","","","[TCP segment of a reassembled PDU]"
"142","4.447203","151.101.48.134","192.168.3.22","TLSv1.2","1406","","443","","","Application Data"
"143","4.447252","192.168.3.22","151.101.48.134","TCP","66","","50732","","","50732  >  443 [ACK] Seq=1063 Ack=5737 Win=129728 Len=0 TSval=776860566 TSecr=2522999174"
"144","4.447252","192.168.3.22","151.101.48.134","TCP","66","","50732","","","50732  >  443 [ACK] Seq=1063 Ack=8525 Win=126944 Len=0 TSval=776860566 TSecr=2522999174"
"145","4.447319","151.101.48.134","192.168.3.22","TCP","1514","","443","","","[TCP segment of a reassembled PDU]"
"146","4.447328","192.168.3.22","151.101.48.134","TCP","66","","50732","","","[TCP Window Update] 50732  >  443 [ACK] Seq=1063 Ack=8525 Win=131072 Len=0 TSval=776860566 TSecr=2522999174"
"147","4.447470","151.101.48.134","192.168.3.22","TLSv1.2","1406","","443","","","Application Data"
"148","4.447472","151.101.48.134","192.168.3.22","TCP","1514","","443","","","[TCP segment of a reassembled PDU]"
"149","4.447508","192.168.3.22","151.101.48.134","TCP","66","","50732","","","50732  >  443 [ACK] Seq=1063 Ack=11313 Win=128256 Len=0 TSval=776860566 TSecr=2522999174"
"150","4.447623","192.168.3.22","151.101.48.134","TCP","66","","50732","","","50732  >  443 [ACK] Seq=1063 Ack=12761 Win=131072 Len=0 TSval=776860566 TSecr=2522999174"
"151","4.447796","151.101.48.134","192.168.3.22","TLSv1.2","1406","","443","","","Application Data"
"152","4.447825","192.168.3.22","151.101.48.134","TCP","66","","50732","","","50732  >  443 [ACK] Seq=1063 Ack=14101 Win=129728 Len=0 TSval=776860566 TSecr=2522999174"
"153","4.462496","192.168.3.22","172.217.195.188","TCP","54","","49513","","","49513  >  5228 [ACK] Seq=1 Ack=1 Win=4096 Len=0"
"154","4.487658","151.101.48.134","192.168.3.22","TCP","1514","","443","","","[TCP segment of a reassembled PDU]"
"155","4.515592","151.101.48.134","192.168.3.22","TLSv1.2","1514","","443","","","Application Data[TCP segment of a reassembled PDU]"
"156","4.515652","192.168.3.22","151.101.48.134","TCP","66","","50732","","","50732  >  443 [ACK] Seq=1063 Ack=16997 Win=129600 Len=0 TSval=776860633 TSecr=2522999185"
"157","4.516504","151.101.48.134","192.168.3.22","TCP","1514","","443","","","[TCP segment of a reassembled PDU]"
"158","4.516573","192.168.3.22","151.101.48.134","TCP","66","","50732","","","50732  >  443 [ACK] Seq=1063 Ack=18445 Win=131072 Len=0 TSval=776860633 TSecr=2522999192"
"159","4.517547","151.101.48.134","192.168.3.22","TLSv1.2","1514","","443","","","Application Data[TCP segment of a reassembled PDU]"
"160","4.517551","151.101.48.134","192.168.3.22","TCP","1514","","443","","","[TCP segment of a reassembled PDU]"
"161","4.517596","192.168.3.22","151.101.48.134","TCP","66","","50732","","","50732  >  443 [ACK] Seq=1063 Ack=21341 Win=128160 Len=0 TSval=776860634 TSecr=2522999192"
"162","4.517645","192.168.3.22","151.101.48.134","TCP","66","","50732","","","[TCP Window Update] 50732  >  443 [ACK] Seq=1063 Ack=21341 Win=131072 Len=0 TSval=776860634 TSecr=2522999192"
"163","4.517827","151.101.48.134","192.168.3.22","TLSv1.2","1261","","443","","","Application DataApplication Data"
"164","4.517861","192.168.3.22","151.101.48.134","TCP","66","","50732","","","50732  >  443 [ACK] Seq=1063 Ack=22536 Win=129856 Len=0 TSval=776860634 TSecr=2522999192"
"165","4.518846","208.180.42.100","192.168.3.22","DNS","134","","53","5483","","Standard query response 0x6dfc A disqus.com A 151.101.0.134 A 151.101.192.134 A 151.101.64.134 A 151.101.128.134"
"166","4.519394","192.168.3.22","151.101.0.134","TCP","78","","50733","","","50733  >  443 [SYN] Seq=0 Win=65535 Len=0 MSS=1460 WS=32 TSval=776860635 TSecr=0 SACK_PERM=1"
"167","4.523074","208.180.42.100","192.168.3.22","DNS","203","","53","48328","","Standard query response 0x59b7 A c.disquscdn.com CNAME c.disquscdn.com.cdn.cloudflare.net A 104.16.77.166 A 104.16.78.166 A 104.16.79.166 A 104.16.76.166 A 104.16.80.166"
"168","4.523626","192.168.3.22","104.16.77.166","TCP","78","","50734","","","50734  >  443 [SYN] Seq=0 Win=65535 Len=0 MSS=1460 WS=32 TSval=776860639 TSecr=0 SACK_PERM=1"
"169","4.526499","172.217.195.188","192.168.3.22","TCP","66","","5228","","","[TCP ACKed unseen segment] 5228  >  49513 [ACK] Seq=1 Ack=2 Win=244 Len=0 TSval=3401072132 TSecr=776497868"
"170","4.558274","151.101.0.134","192.168.3.22","TCP","74","","443","","","443  >  50733 [SYN, ACK] Seq=0 Ack=1 Win=28960 Len=0 MSS=1460 SACK_PERM=1 TSval=1594102934 TSecr=776860635 WS=512"
"171","4.558355","192.168.3.22","151.101.0.134","TCP","66","","50733","","","50733  >  443 [ACK] Seq=1 Ack=1 Win=131744 Len=0 TSval=776860672 TSecr=1594102934"
"172","4.558637","192.168.3.22","151.101.0.134","TLSv1.2","583","","50733","","","Client Hello"
"173","4.559204","104.16.77.166","192.168.3.22","TCP","66","","443","","","443  >  50734 [SYN, ACK] Seq=0 Ack=1 Win=29200 Len=0 MSS=1460 SACK_PERM=1 WS=1024"
"174","4.559255","192.168.3.22","104.16.77.166","TCP","54","","50734","","","50734  >  443 [ACK] Seq=1 Ack=1 Win=262144 Len=0"
"175","4.559538","192.168.3.22","104.16.77.166","TLSv1.2","605","","50734","","","Client Hello"
"176","4.578497","151.101.0.134","192.168.3.22","TCP","66","","443","","","443  >  50733 [ACK] Seq=1 Ack=518 Win=30208 Len=0 TSval=1594102939 TSecr=776860672"
"177","4.579571","104.16.77.166","192.168.3.22","TCP","60","","443","","","443  >  50734 [ACK] Seq=1 Ack=552 Win=30720 Len=0"
"178","4.579863","151.101.0.134","192.168.3.22","TLSv1.2","226","","443","","","Server Hello, Change Cipher Spec, Encrypted Handshake Message"
"179","4.579941","192.168.3.22","151.101.0.134","TCP","66","","50733","","","50733  >  443 [ACK] Seq=518 Ack=161 Win=131584 Len=0 TSval=776860692 TSecr=1594102939"
"180","4.580050","192.168.3.22","151.101.0.134","TLSv1.2","117","","50733","","","Change Cipher Spec, Hello Request, Hello Request"
"181","4.581129","104.16.77.166","192.168.3.22","TLSv1.2","266","","443","","","Server Hello, Change Cipher Spec, Application Data"
"182","4.581227","192.168.3.22","104.16.77.166","TCP","54","","50734","","","50734  >  443 [ACK] Seq=552 Ack=213 Win=261920 Len=0"
"183","4.581851","192.168.3.22","104.16.77.166","TLSv1.2","118","","50734","","","Change Cipher Spec, Application Data"
"184","4.591537","192.168.3.22","151.101.0.134","TLSv1.2","551","","50733","","","Application Data"
"185","4.592061","192.168.3.22","185.199.108.153","HTTP","630","","50729","","www.austintaylor.io","GET /favicon-32x32.png HTTP/1.1 "
"186","4.608429","151.101.0.134","192.168.3.22","TCP","66","","443","","","443  >  50733 [ACK] Seq=161 Ack=1054 Win=31232 Len=0 TSval=1594102947 TSecr=776860692"
"187","4.611036","104.16.77.166","192.168.3.22","TLSv1.2","504","","443","","","Application Data"
"188","4.611076","192.168.3.22","104.16.77.166","TCP","54","","50734","","","50734  >  443 [ACK] Seq=616 Ack=663 Win=261664 Len=0"
"189","4.611240","104.16.77.166","192.168.3.22","TLSv1.2","116","","443","","","Application Data"
"190","4.611242","151.101.0.134","192.168.3.22","TCP","1514","","443","","","[TCP segment of a reassembled PDU]"
"191","4.611273","192.168.3.22","104.16.77.166","TCP","54","","50734","","","50734  >  443 [ACK] Seq=616 Ack=725 Win=261632 Len=0"
"192","4.611370","151.101.0.134","192.168.3.22","TLSv1.2","1406","","443","","","Application Data"
"193","4.611410","192.168.3.22","151.101.0.134","TCP","66","","50733","","","50733  >  443 [ACK] Seq=1054 Ack=2949 Win=129728 Len=0 TSval=776860721 TSecr=1594102947"
"194","4.611663","151.101.0.134","192.168.3.22","TLSv1.2","590","","443","","","Application Data"
"195","4.611699","192.168.3.22","151.101.0.134","TCP","66","","50733","","","50733  >  443 [ACK] Seq=1054 Ack=3473 Win=130528 Len=0 TSval=776860721 TSecr=1594102947"
"196","4.649324","185.199.108.153","192.168.3.22","TCP","66","","80","","","80  >  50729 [ACK] Seq=1989 Ack=3636 Win=37376 Len=0 TSval=1449785323 TSecr=776860703"
"197","4.651822","185.199.108.153","192.168.3.22","HTTP","1130","","80","","","HTTP/1.1 200 OK  (PNG)"
"198","4.651868","192.168.3.22","185.199.108.153","TCP","66","","50729","","","50729  >  80 [ACK] Seq=3636 Ack=3053 Win=129984 Len=0 TSval=776860761 TSecr=1449785323"
"199","4.985618","192.168.3.22","192.30.253.112","TCP","78","","50735","","","50735  >  443 [SYN] Seq=0 Win=65535 Len=0 MSS=1460 WS=32 TSval=776861092 TSecr=0 SACK_PERM=1"
"200","5.038448","192.30.253.112","192.168.3.22","TCP","74","","443","","","443  >  50735 [SYN, ACK] Seq=0 Ack=1 Win=28480 Len=0 MSS=1436 SACK_PERM=1 TSval=2172326167 TSecr=776861092 WS=1024"
"201","5.038518","192.168.3.22","192.30.253.112","TCP","66","","50735","","","50735  >  443 [ACK] Seq=1 Ack=1 Win=132416 Len=0 TSval=776861144 TSecr=2172326167"
"202","5.038730","192.168.3.22","192.30.253.112","TLSv1.2","583","","50735","","","Client Hello"
"203","5.099161","192.30.253.112","192.168.3.22","TLSv1.2","1490","","443","","","Server Hello, Change Cipher Spec, Application Data"
"204","5.100082","192.30.253.112","192.168.3.22","TCP","1490","","443","","","[TCP segment of a reassembled PDU]"
"205","5.100126","192.168.3.22","192.30.253.112","TCP","66","","50735","","","50735  >  443 [ACK] Seq=518 Ack=2849 Win=129632 Len=0 TSval=776861204 TSecr=2172326182"
"206","5.100639","192.30.253.112","192.168.3.22","TLSv1.2","854","","443","","","Application DataApplication Data, Application Data"
"207","5.100671","192.168.3.22","192.30.253.112","TCP","66","","50735","","","50735  >  443 [ACK] Seq=518 Ack=3637 Win=130272 Len=0 TSval=776861205 TSecr=2172326182"
"208","5.100982","192.168.3.22","192.30.253.112","TLSv1.2","130","","50735","","","Change Cipher Spec, Application Data"
"209","5.101816","192.168.3.22","192.30.253.112","TLSv1.2","1406","","50735","","","Application Data"
"210","5.154241","192.30.253.112","192.168.3.22","TLSv1.2","145","","443","","","Application Data"
"211","5.154292","192.168.3.22","192.30.253.112","TCP","66","","50735","","","50735  >  443 [ACK] Seq=1922 Ack=3716 Win=130976 Len=0 TSval=776861258 TSecr=2172326196"
"212","5.154535","192.30.253.112","192.168.3.22","TLSv1.2","145","","443","","","Application Data"
"213","5.154569","192.168.3.22","192.30.253.112","TCP","66","","50735","","","50735  >  443 [ACK] Seq=1922 Ack=3795 Win=130976 Len=0 TSval=776861258 TSecr=2172326196"
"214","5.201336","192.30.253.112","192.168.3.22","TCP","66","","443","","","443  >  50735 [ACK] Seq=3795 Ack=1922 Win=32768 Len=0 TSval=2172326208 TSecr=776861206"
"215","5.674924","192.168.3.22","151.101.0.134","TLSv1.2","1326","","50733","","","Application Data"
"216","5.731484","151.101.0.134","192.168.3.22","TCP","66","","443","","","443  >  50733 [ACK] Seq=3473 Ack=2314 Win=33792 Len=0 TSval=1594103228 TSecr=776861777"
"217","5.742439","151.101.0.134","192.168.3.22","TLSv1.2","483","","443","","","Application Data"
"218","5.742490","192.168.3.22","151.101.0.134","TCP","66","","50733","","","50733  >  443 [ACK] Seq=2314 Ack=3890 Win=130624 Len=0 TSval=776861844 TSecr=1594103229"
"219","5.929027","192.30.253.112","192.168.3.22","TLSv1.2","1458","","443","","","Application Data"
"220","5.929099","192.168.3.22","192.30.253.112","TCP","66","","50735","","","50735  >  443 [ACK] Seq=1922 Ack=5187 Win=129664 Len=0 TSval=776862029 TSecr=2172326389"
"221","5.929209","192.30.253.112","192.168.3.22","TLSv1.2","1458","","443","","","Application Data"
"222","5.929255","192.168.3.22","192.30.253.112","TCP","66","","50735","","","50735  >  443 [ACK] Seq=1922 Ack=6579 Win=129664 Len=0 TSval=776862029 TSecr=2172326389"
"223","5.930030","192.30.253.112","192.168.3.22","TLSv1.2","1458","","443","","","Application Data"
"224","5.930063","192.168.3.22","192.30.253.112","TCP","66","","50735","","","50735  >  443 [ACK] Seq=1922 Ack=7971 Win=129664 Len=0 TSval=776862029 TSecr=2172326389"
"225","5.930283","192.30.253.112","192.168.3.22","TLSv1.2","1490","","443","","","Application Data"
"226","5.931503","192.30.253.112","192.168.3.22","TLSv1.2","1426","","443","","","Application Data"
"227","5.931548","192.168.3.22","192.30.253.112","TCP","66","","50735","","","50735  >  443 [ACK] Seq=1922 Ack=10755 Win=129696 Len=0 TSval=776862031 TSecr=2172326389"
"228","5.931977","192.30.253.112","192.168.3.22","TLSv1.2","1490","","443","","","Application Data"
"229","5.932243","192.30.253.112","192.168.3.22","TLSv1.2","1426","","443","","","Application Data"
"230","5.932278","192.168.3.22","192.30.253.112","TCP","66","","50735","","","50735  >  443 [ACK] Seq=1922 Ack=13539 Win=129696 Len=0 TSval=776862031 TSecr=2172326389"
"231","5.933375","192.30.253.112","192.168.3.22","TLSv1.2","1490","","443","","","Application Data"
"232","5.933749","192.30.253.112","192.168.3.22","TLSv1.2","1490","","443","","","Application Data[TCP segment of a reassembled PDU]"
"233","5.933798","192.168.3.22","192.30.253.112","TCP","66","","50735","","","50735  >  443 [ACK] Seq=1922 Ack=16387 Win=129632 Len=0 TSval=776862032 TSecr=2172326389"
"234","5.934490","192.30.253.112","192.168.3.22","TLSv1.2","1394","","443","","","Application Data"
"235","5.934523","192.168.3.22","192.30.253.112","TCP","66","","50735","","","50735  >  443 [ACK] Seq=1922 Ack=17715 Win=129728 Len=0 TSval=776862033 TSecr=2172326389"
"236","5.942488","192.168.3.22","192.30.253.125","TLSv1.2","96","","50144","","","Application Data"
"237","5.942624","192.168.3.22","192.30.253.125","TCP","66","","50144","","","50144  >  443 [FIN, ACK] Seq=31 Ack=1 Win=4096 Len=0 TSval=776862040 TSecr=3595583854"
"238","5.983379","192.30.253.112","192.168.3.22","TLSv1.2","1490","","443","","","Application Data"
"239","5.983620","192.30.253.112","192.168.3.22","TLSv1.2","1490","","443","","","Application Data[TCP segment of a reassembled PDU]"
"240","5.983657","192.168.3.22","192.30.253.112","TCP","66","","50735","","","50735  >  443 [ACK] Seq=1922 Ack=20563 Win=129632 Len=0 TSval=776862080 TSecr=2172326403"
"241","5.984285","192.30.253.112","192.168.3.22","TLSv1.2","1490","","443","","","Application Data[TCP segment of a reassembled PDU]"
"242","5.984346","192.168.3.22","192.30.253.112","TCP","66","","50735","","","50735  >  443 [ACK] Seq=1922 Ack=21987 Win=131072 Len=0 TSval=776862080 TSecr=2172326403"
"243","5.984872","192.30.253.112","192.168.3.22","TLSv1.2","1490","","443","","","Application Data[TCP segment of a reassembled PDU]"
"244","5.984875","192.30.253.112","192.168.3.22","TLSv1.2","1490","","443","","","Application Data[TCP segment of a reassembled PDU]"
"245","5.984876","192.30.253.112","192.168.3.22","TLSv1.2","1490","","443","","","Application Data[TCP segment of a reassembled PDU]"
"246","5.984912","192.168.3.22","192.30.253.112","TCP","66","","50735","","","50735  >  443 [ACK] Seq=1922 Ack=24835 Win=128224 Len=0 TSval=776862081 TSecr=2172326403"
"247","5.985007","192.168.3.22","192.30.253.112","TCP","66","","50735","","","50735  >  443 [ACK] Seq=1922 Ack=26259 Win=131072 Len=0 TSval=776862081 TSecr=2172326403"
"248","5.986255","192.30.253.112","192.168.3.22","TLSv1.2","1490","","443","","","Application Data[TCP segment of a reassembled PDU]"
"249","5.986258","192.30.253.112","192.168.3.22","TLSv1.2","1490","","443","","","Application Data[TCP segment of a reassembled PDU]"
"250","5.986296","192.168.3.22","192.30.253.112","TCP","66","","50735","","","50735  >  443 [ACK] Seq=1922 Ack=29107 Win=128224 Len=0 TSval=776862082 TSecr=2172326403"
"251","5.986330","192.168.3.22","192.30.253.112","TCP","66","","50735","","","[TCP Window Update] 50735  >  443 [ACK] Seq=1922 Ack=29107 Win=131072 Len=0 TSval=776862082 TSecr=2172326403"
"252","5.987064","192.30.253.112","192.168.3.22","TLSv1.2","1490","","443","","","Application Data[TCP segment of a reassembled PDU]"
"253","5.987068","192.30.253.112","192.168.3.22","TLSv1.2","1490","","443","","","Application Data[TCP segment of a reassembled PDU]"
"254","5.987100","192.168.3.22","192.30.253.112","TCP","66","","50735","","","50735  >  443 [ACK] Seq=1922 Ack=31955 Win=128224 Len=0 TSval=776862082 TSecr=2172326403"
"255","5.987123","192.168.3.22","192.30.253.112","TCP","66","","50735","","","[TCP Window Update] 50735  >  443 [ACK] Seq=1922 Ack=31955 Win=131072 Len=0 TSval=776862082 TSecr=2172326403"
"256","5.987297","192.30.253.112","192.168.3.22","TLSv1.2","80","","443","","","Application Data"
"257","5.987332","192.168.3.22","192.30.253.112","TCP","66","","50735","","","50735  >  443 [ACK] Seq=1922 Ack=31969 Win=131040 Len=0 TSval=776862083 TSecr=2172326403"
"258","6.007594","192.30.253.125","192.168.3.22","TCP","66","","443","","","443  >  50144 [ACK] Seq=1 Ack=31 Win=31 Len=0 TSval=3595588357 TSecr=776862040"
"259","6.008454","192.30.253.125","192.168.3.22","TLSv1.2","92","","443","","","Application Data"
"260","6.008510","192.168.3.22","192.30.253.125","TCP","54","","50144","","","50144  >  443 [RST] Seq=32 Win=0 Len=0"
"261","6.009189","192.30.253.125","192.168.3.22","TLSv1.2","90","","443","","","Application Data"
"262","6.009192","192.30.253.125","192.168.3.22","TCP","66","","443","","","443  >  50144 [FIN, ACK] Seq=51 Ack=32 Win=31 Len=0 TSval=3595588358 TSecr=776862040"
"263","6.047958","192.168.3.22","208.180.42.100","DNS","90","","6963","53","","Standard query 0xfe27 A avatars2.githubusercontent.com"
"264","6.048320","192.168.3.22","208.180.42.100","DNS","90","","31944","53","","Standard query 0xccd4 A avatars0.githubusercontent.com"
"265","6.064421","208.180.42.100","192.168.3.22","DNS","141","","53","6963","","Standard query response 0xfe27 A avatars2.githubusercontent.com CNAME github.map.fastly.net A 151.101.48.133"
"266","6.064654","192.168.3.22","151.101.48.133","TCP","78","","50736","","","50736  >  443 [SYN] Seq=0 Win=65535 Len=0 MSS=1460 WS=32 TSval=776862158 TSecr=0 SACK_PERM=1"
"267","6.066640","192.168.3.22","208.180.42.100","DNS","90","","24581","53","","Standard query 0xfbd7 A avatars1.githubusercontent.com"
"268","6.067272","192.168.3.22","208.180.42.100","DNS","90","","39260","53","","Standard query 0x2017 A avatars3.githubusercontent.com"
"269","6.070639","208.180.42.100","192.168.3.22","DNS","141","","53","31944","","Standard query response 0xccd4 A avatars0.githubusercontent.com CNAME github.map.fastly.net A 151.101.48.133"
"270","6.070827","192.168.3.22","151.101.48.133","TCP","78","","50737","","","50737  >  443 [SYN] Seq=0 Win=65535 Len=0 MSS=1460 WS=32 TSval=776862164 TSecr=0 SACK_PERM=1"
"271","6.070873","192.168.3.22","151.101.48.133","TCP","78","","50738","","","50738  >  443 [SYN] Seq=0 Win=65535 Len=0 MSS=1460 WS=32 TSval=776862164 TSecr=0 SACK_PERM=1"
"272","6.071510","192.168.3.22","208.180.42.100","DNS","89","","13000","53","","Standard query 0xb83e A github-cloud.s3.amazonaws.com"
"273","6.075066","192.168.3.22","172.217.12.36","QUIC","572","","53507","443","","Payload (Encrypted), PKN: 14, CID: 889214629929434550"
"274","6.078591","151.101.48.133","192.168.3.22","TCP","74","","443","","","443  >  50736 [SYN, ACK] Seq=0 Ack=1 Win=28960 Len=0 MSS=1460 SACK_PERM=1 TSval=1440298142 TSecr=776862158 WS=512"
"275","6.078685","192.168.3.22","151.101.48.133","TCP","66","","50736","","","50736  >  443 [ACK] Seq=1 Ack=1 Win=131744 Len=0 TSval=776862171 TSecr=1440298142"
"276","6.079087","192.168.3.22","151.101.48.133","TLSv1.2","601","","50736","","","Client Hello"
"277","6.081520","208.180.42.100","192.168.3.22","DNS","141","","53","24581","","Standard query response 0xfbd7 A avatars1.githubusercontent.com CNAME github.map.fastly.net A 151.101.48.133"
"278","6.084721","192.168.3.22","208.180.42.100","DNS","93","","22067","53","","Standard query 0x2e14 A user-images.githubusercontent.com"
"279","6.085695","151.101.48.133","192.168.3.22","TCP","74","","443","","","443  >  50738 [SYN, ACK] Seq=0 Ack=1 Win=28960 Len=0 MSS=1460 SACK_PERM=1 TSval=1373214522 TSecr=776862164 WS=512"
"280","6.085751","192.168.3.22","151.101.48.133","TCP","66","","50738","","","50738  >  443 [ACK] Seq=1 Ack=1 Win=131744 Len=0 TSval=776862178 TSecr=1373214522"
"281","6.086260","192.168.3.22","151.101.48.133","TLSv1.2","601","","50738","","","Client Hello"
